{
  "businessId": "XAIS12345678910",
  "typeOfBusiness": "self-employment",
  "tradingName": "Aardvark Window Cleaning Services",
  "accountingPeriods":
  [
    {
      "start": "2018-04-06",
      "end": "2019-04-05"
    }
  ],
  "accountingType": "ACCRUALS",
  "commencementDate": "2016-09-24",
  "cessationDate": "2020-03-24",
  "businessAddressLineOne": "6 Harpic Drive",
  "businessAddressLineTwo": "Domestos Wood",
  "businessAddressLineThree": "ToiletDucktown",
  "businessAddressLineFour": "CIFSHIRE",
  "businessAddressPostcode": "SW4F 3GA",
  "businessAddressCountryCode": "GB"
}